{
  "schemaVersion": "1.0.0",
  "cutoverId": "CUTOVER-2026-07-21-01",
  "status": "prepared",
  "rank": null,
  "repository": "merrick143/mez-studios-design",
  "branch": "codex/brand-kit-workbench",
  "path": "brand-kit",
  "productionAuthority": false,
  "activeRelease": "0.1.0-alpha.1",
  "previousAuthority": {
    "repository": "merrick143/mezcorp-claudecode",
    "branch": "codex/mez-gradient-system",
    "path": "departments/cmo/brand-library/brands/mez-systems",
    "rollbackCommit": "822aa91",
    "transitionCommit": null,
    "stateAfterActivation": "pinned-archive-and-consumer-reference"
  },
  "activationConditions": [
    "release 0.1.0-alpha.1 validates from a clean clone",
    "internal rollback commit 822aa91 remains reachable",
    "the internal transfer record carries the same cutover ID",
    "all target authority and artifact validators pass"
  ],
  "rollback": {
    "record": "authority/rollback.json",
    "procedure": "Restore rank-one authority to the pinned internal rollback commit and mark this target authority suspended through a new recorded decision."
  }
}
